{
  "$schema": "https://json-schema.org/draft/2020-12/schema",
  "$id": "ADR0043-PH0-D-BOX-O34-O3-ARCHIVE-SCHEMA-001",
  "title": "O3 historical-replay corpus archive (candidate)",
  "type": "object",
  "additionalProperties": false,
  "required": [
    "archive_id",
    "archive_kind",
    "schema_id",
    "account_scope",
    "eligibility_window",
    "observations",
    "counts",
    "construction_freeze_id",
    "provenance"
  ],
  "properties": {
    "archive_id": { "type": "string", "minLength": 1 },
    "archive_kind": { "const": "O3_HISTORICAL_REPLAY" },
    "schema_id": { "const": "ADR0043-PH0-D-BOX-O34-O3-ARCHIVE-SCHEMA-001" },
    "account_scope": {
      "type": "object",
      "additionalProperties": false,
      "required": ["workbench_account_id", "broker_account_id"],
      "properties": {
        "workbench_account_id": { "const": 3 },
        "broker_account_id": { "const": "PA34USW0Q8UO" }
      }
    },
    "eligibility_window": {
      "type": "object",
      "additionalProperties": false,
      "required": ["start_inclusive_utc", "end_exclusive_utc"],
      "properties": {
        "start_inclusive_utc": { "type": "string", "pattern": "^\\d{4}-\\d{2}-\\d{2}T\\d{2}:\\d{2}:\\d{2}Z$" },
        "end_exclusive_utc": { "type": "string", "pattern": "^\\d{4}-\\d{2}-\\d{2}T\\d{2}:\\d{2}:\\d{2}Z$" }
      }
    },
    "observations": {
      "type": "array",
      "items": {
        "type": "object",
        "additionalProperties": false,
        "required": [
          "observation_id",
          "plan_id",
          "symbol",
          "session_id",
          "plan_created_at_utc",
          "source_lineage"
        ],
        "properties": {
          "observation_id": { "type": "string", "minLength": 1 },
          "plan_id": { "type": "string", "minLength": 1 },
          "symbol": { "type": "string", "minLength": 1 },
          "session_id": { "type": "string", "minLength": 1 },
          "plan_created_at_utc": { "type": "string" },
          "quote_provenance": { "type": ["object", "null"] },
          "authority_inputs": { "type": ["object", "null"] },
          "checkpoint_tuple": { "type": ["object", "null"] },
          "loss_accounting_inputs": { "type": ["object", "null"] },
          "recovery_inputs": { "type": ["object", "null"] },
          "source_lineage": {
            "type": "object",
            "additionalProperties": false,
            "required": ["source_class", "source_snapshot_id", "source_row_key"],
            "properties": {
              "source_class": { "type": "string" },
              "source_snapshot_id": { "type": "string" },
              "source_row_key": { "type": "string" }
            }
          }
        }
      }
    },
    "counts": {
      "type": "object",
      "additionalProperties": false,
      "required": ["n_observations", "n_unique_plans", "n_clusters"],
      "properties": {
        "n_observations": { "type": "integer", "minimum": 0 },
        "n_unique_plans": { "type": "integer", "minimum": 0 },
        "n_clusters": { "type": "integer", "minimum": 0 }
      }
    },
    "construction_freeze_id": { "const": "ADR0043-PH0-D-BOX-O34-ACQ-FREEZE-001" },
    "provenance": {
      "type": "object",
      "additionalProperties": false,
      "required": ["constructor", "tooling_commit", "constructed_at_utc"],
      "properties": {
        "constructor": { "type": "string" },
        "tooling_commit": { "type": "string", "pattern": "^[0-9a-f]{40}$" },
        "constructed_at_utc": { "type": "string" },
        "host": { "type": ["string", "null"] }
      }
    }
  }
}
