{"account_scope":{"broker_account_id":"PA34USW0Q8UO","workbench_account_id":3},"archive_id":"O3-CAND-20260730T022316Z","archive_kind":"O3_HISTORICAL_REPLAY","construction_freeze_id":"ADR0043-PH0-D-BOX-O34-ACQ-FREEZE-001","counts":{"n_clusters":20,"n_observations":292,"n_unique_plans":292},"eligibility_window":{"end_exclusive_utc":"2026-07-30T00:21:33Z","start_inclusive_utc":"2026-06-30T00:00:00Z"},"observations":[{"authority_inputs":{"account_id":3,"broker_account_id":"PA34USW0Q8UO","qty":"500","side":"BUY","source_id":null,"source_type":"STRATEGY","status":"FILLED"},"checkpoint_tuple":null,"loss_accounting_inputs":null,"observation_id":"o3:ord:1080","plan_created_at_utc":"2026-07-13T19:18:15Z","plan_id":"ord:1080","quote_provenance":null,"recovery_inputs":null,"session_id":"F|2026-07-13","source_lineage":{"source_class":"application_audit_plan_checkpoint_terminal_records","source_row_key":"orders.id=1080","source_snapshot_id":"20260730T022316Z"},"symbol":"F"},{"authority_inputs":{"account_id":3,"broker_account_id":"PA34USW0Q8UO","qty":"20","side":"BUY","source_id":null,"source_type":"STRATEGY","status":"FILLED"},"checkpoint_tuple":null,"loss_accounting_inputs":null,"observation_id":"o3:ord:1081","plan_created_at_utc":"2026-07-13T19:18:16Z","plan_id":"ord:1081","quote_provenance":null,"recovery_inputs":null,"session_id":"MSFT|2026-07-13","source_lineage":{"source_class":"application_audit_plan_checkpoint_terminal_records","source_row_key":"orders.id=1081","source_snapshot_id":"20260730T022316Z"},"symbol":"MSFT"},{"authority_inputs":{"account_id":3,"broker_account_id":"PA34USW0Q8UO","qty":"334","side":"BUY","source_id":null,"source_type":"STRATEGY","status":"FILLED"},"checkpoint_tuple":null,"loss_accounting_inputs":null,"observation_id":"o3:ord:1082","plan_created_at_utc":"2026-07-13T19:22:50Z","plan_id":"ord:1082","quote_provenance":null,"recovery_inputs":null,"session_id":"IEUS|2026-07-13","source_lineage":{"source_class":"application_audit_plan_checkpoint_terminal_records","source_row_key":"orders.id=1082","source_snapshot_id":"20260730T022316Z"},"symbol":"IEUS"},{"authority_inputs":{"account_id":3,"broker_account_id":"PA34USW0Q8UO","qty":"182","side":"BUY","source_id":null,"source_type":"STRATEGY","status":"FILLED"},"checkpoint_tuple":null,"loss_accounting_inputs":null,"observation_id":"o3:ord:1083","plan_created_at_utc":"2026-07-13T19:22:57Z","plan_id":"ord:1083","quote_provenance":null,"recovery_inputs":null,"session_id":"KOKU|2026-07-13","source_lineage":{"source_class":"application_audit_plan_checkpoint_terminal_records","source_row_key":"orders.id=1083","source_snapshot_id":"20260730T022316Z"},"symbol":"KOKU"},{"authority_inputs":{"account_id":3,"broker_account_id":"PA34USW0Q8UO","qty":"500","side":"SELL","source_id":null,"source_type":"MANUAL","status":"FILLED"},"checkpoint_tuple":null,"loss_accounting_inputs":null,"observation_id":"o3:ord:1084","plan_created_at_utc":"2026-07-13T19:25:18Z","plan_id":"ord:1084","quote_provenance":null,"recovery_inputs":null,"session_id":"F|2026-07-13","source_lineage":{"source_class":"application_audit_plan_checkpoint_terminal_records","source_row_key":"orders.id=1084","source_snapshot_id":"20260730T022316Z"},"symbol":"F"},{"authority_inputs":{"account_id":3,"broker_account_id":"PA34USW0Q8UO","qty":"334","side":"SELL","source_id":null,"source_type":"MANUAL","status":"FILLED"},"checkpoint_tuple":null,"loss_accounting_inputs":null,"observation_id":"o3:ord:1085","plan_created_at_utc":"2026-07-13T19:25:20Z","plan_id":"ord:1085","quote_provenance":null,"recovery_inputs":null,"session_id":"IEUS|2026-07-13","source_lineage":{"source_class":"application_audit_plan_checkpoint_terminal_records","source_row_key":"orders.id=1085","source_snapshot_id":"20260730T022316Z"},"symbol":"IEUS"},{"authority_inputs":{"account_id":3,"broker_account_id":"PA34USW0Q8UO","qty":"182","side":"SELL","source_id":null,"source_type":"MANUAL","status":"FILLED"},"checkpoint_tuple":null,"loss_accounting_inputs":null,"observation_id":"o3:ord:1086","plan_created_at_utc":"2026-07-13T19:25:22Z","plan_id":"ord:1086","quote_provenance":null,"recovery_inputs":null,"session_id":"KOKU|2026-07-13","source_lineage":{"source_class":"application_audit_plan_checkpoint_terminal_records","source_row_key":"orders.id=1086","source_snapshot_id":"20260730T022316Z"},"symbol":"KOKU"},{"authority_inputs":{"account_id":3,"broker_account_id":"PA34USW0Q8UO","qty":"20","side":"SELL","source_id":null,"source_type":"MANUAL","status":"FILLED"},"checkpoint_tuple":null,"loss_accounting_inputs":null,"observation_id":"o3:ord:1087","plan_created_at_utc":"2026-07-13T19:25:24Z","plan_id":"ord:1087","quote_provenance":null,"recovery_inputs":null,"session_id":"MSFT|2026-07-13","source_lineage":{"source_class":"application_audit_plan_checkpoint_terminal_records","source_row_key":"orders.id=1087","source_snapshot_id":"20260730T022316Z"},"symbol":"MSFT"},{"authority_inputs":{"account_id":3,"broker_account_id":"PA34USW0Q8UO","qty":"344","side":"BUY","source_id":null,"source_type":"MANUAL","status":"FILLED"},"checkpoint_tuple":null,"loss_accounting_inputs":null,"observation_id":"o3:ord:1088","plan_created_at_utc":"2026-07-13T19:26:35Z","plan_id":"ord:1088","quote_provenance":null,"recovery_inputs":null,"session_id":"IEUS|2026-07-13","source_lineage":{"source_class":"application_audit_plan_checkpoint_terminal_records","source_row_key":"orders.id=1088","source_snapshot_id":"20260730T022316Z"},"symbol":"IEUS"},{"authority_inputs":{"account_id":3,"broker_account_id":"PA34USW0Q8UO","qty":"184","side":"BUY","source_id":null,"source_type":"MANUAL","status":"FILLED"},"checkpoint_tuple":null,"loss_accounting_inputs":null,"observation_id":"o3:ord:1089","plan_created_at_utc":"2026-07-13T19:26:37Z","plan_id":"ord:1089","quote_provenance":null,"recovery_inputs":null,"session_id":"KOKU|2026-07-13","source_lineage":{"source_class":"application_audit_plan_checkpoint_terminal_records","source_row_key":"orders.id=1089","source_snapshot_id":"20260730T022316Z"},"symbol":"KOKU"},{"authority_inputs":{"account_id":3,"broker_account_id":"PA34USW0Q8UO","qty":"434","side":"BUY","source_id":null,"source_type":"MANUAL","status":"FILLED"},"checkpoint_tuple":null,"loss_accounting_inputs":null,"observation_id":"o3:ord:1090","plan_created_at_utc":"2026-07-13T19:26:39Z","plan_id":"ord:1090","quote_provenance":null,"recovery_inputs":null,"session_id":"F|2026-07-13","source_lineage":{"source_class":"application_audit_plan_checkpoint_terminal_records","source_row_key":"orders.id=1090","source_snapshot_id":"20260730T022316Z"},"symbol":"F"},{"authority_inputs":{"account_id":3,"broker_account_id":"PA34USW0Q8UO","qty":"19","side":"BUY","source_id":null,"source_type":"MANUAL","status":"FILLED"},"checkpoint_tuple":null,"loss_accounting_inputs":null,"observation_id":"o3:ord:1091","plan_created_at_utc":"2026-07-13T19:26:40Z","plan_id":"ord:1091","quote_provenance":null,"recovery_inputs":null,"session_id":"MSFT|2026-07-13","source_lineage":{"source_class":"application_audit_plan_checkpoint_terminal_records","source_row_key":"orders.id=1091","source_snapshot_id":"20260730T022316Z"},"symbol":"MSFT"},{"authority_inputs":{"account_id":3,"broker_account_id":"PA34USW0Q8UO","qty":"434","side":"SELL","source_id":null,"source_type":"MANUAL","status":"FILLED"},"checkpoint_tuple":null,"loss_accounting_inputs":null,"observation_id":"o3:ord:1092","plan_created_at_utc":"2026-07-13T19:26:47Z","plan_id":"ord:1092","quote_provenance":null,"recovery_inputs":null,"session_id":"F|2026-07-13","source_lineage":{"source_class":"application_audit_plan_checkpoint_terminal_records","source_row_key":"orders.id=1092","source_snapshot_id":"20260730T022316Z"},"symbol":"F"},{"authority_inputs":{"account_id":3,"broker_account_id":"PA34USW0Q8UO","qty":"344","side":"SELL","source_id":null,"source_type":"MANUAL","status":"FILLED"},"checkpoint_tuple":null,"loss_accounting_inputs":null,"observation_id":"o3:ord:1093","plan_created_at_utc":"2026-07-13T19:26:49Z","plan_id":"ord:1093","quote_provenance":null,"recovery_inputs":null,"session_id":"IEUS|2026-07-13","source_lineage":{"source_class":"application_audit_plan_checkpoint_terminal_records","source_row_key":"orders.id=1093","source_snapshot_id":"20260730T022316Z"},"symbol":"IEUS"},{"authority_inputs":{"account_id":3,"broker_account_id":"PA34USW0Q8UO","qty":"184","side":"SELL","source_id":null,"source_type":"MANUAL","status":"FILLED"},"checkpoint_tuple":null,"loss_accounting_inputs":null,"observation_id":"o3:ord:1094","plan_created_at_utc":"2026-07-13T19:26:50Z","plan_id":"ord:1094","quote_provenance":null,"recovery_inputs":null,"session_id":"KOKU|2026-07-13","source_lineage":{"source_class":"application_audit_plan_checkpoint_terminal_records","source_row_key":"orders.id=1094","source_snapshot_id":"20260730T022316Z"},"symbol":"KOKU"},{"authority_inputs":{"account_id":3,"broker_account_id":"PA34USW0Q8UO","qty":"19","side":"SELL","source_id":null,"source_type":"MANUAL","status":"FILLED"},"checkpoint_tuple":null,"loss_accounting_inputs":null,"observation_id":"o3:ord:1095","plan_created_at_utc":"2026-07-13T19:26:52Z","plan_id":"ord:1095","quote_provenance":null,"recovery_inputs":null,"session_id":"MSFT|2026-07-13","source_lineage":{"source_class":"application_audit_plan_checkpoint_terminal_records","source_row_key":"orders.id=1095","source_snapshot_id":"20260730T022316Z"},"symbol":"MSFT"},{"authority_inputs":{"account_id":3,"broker_account_id":"PA34USW0Q8UO","qty":"344","side":"BUY","source_id":null,"source_type":"MANUAL","status":"FILLED"},"checkpoint_tuple":null,"loss_accounting_inputs":null,"observation_id":"o3:ord:1096","plan_created_at_utc":"2026-07-13T19:27:00Z","plan_id":"ord:1096","quote_provenance":null,"recovery_inputs":null,"session_id":"IEUS|2026-07-13","source_lineage":{"source_class":"application_audit_plan_checkpoint_terminal_records","source_row_key":"orders.id=1096","source_snapshot_id":"20260730T022316Z"},"symbol":"IEUS"},{"authority_inputs":{"account_id":3,"brok